{
  "base_revision": "AOS-000377",
  "blockers": [
    "NO_EXTERNAL_EFFECT;NO_RELEASE"
  ],
  "changed_files": [
    "apps/web/src/components/workshop/**",
    "apps/web/src/styles/45-ecommerce-workshop.css",
    ".evidence/workshop/2026-08-28-eight-menu-business-visual-seal/**"
  ],
  "commits": [
    "60e0c3ef"
  ],
  "completed_at": "2026-08-28T01:32:02+08:00",
  "completed_revision": "AOS-000378",
  "result": "PRIMARY_EIGHT_MENU_VISUAL_FUNCTION_DATA_SEAL_GREEN_SUPERSEDED_BY_20260828_DELIVERY",
  "risks": [
    "No release; visual demo data replaced by current/empty business state"
  ],
  "schema": "aos-memory-delivery-receipt/v1",
  "task_id": "S8-VISUAL-PRIMARY-EIGHT-MENU-CORRECTION",
  "verification": [
    "See workshop-eight-menu-visual-function-data-seal-20260828 Delivery Receipt; 24 same-viewport pairs; 2310/2310 Web; 30/30 backend; build GREEN"
  ]
}
