{
  "base_revision": "AOS-000202",
  "blockers": [],
  "changed_files": [
    "services/aos-api/aos_api/ecommerce_workshop_customer.py",
    "services/aos-api/aos_api/ecommerce_workshop_customer_contracts.py",
    "services/aos-api/aos_api/routers/ecommerce_workshop.py",
    "services/aos-api/tests/test_ecommerce_workshop_customer.py",
    "services/aos-api/tests/test_ecommerce_workshop_api.py",
    "services/aos-api/tests/test_openapi_contract.py",
    "scripts/export_openapi.py",
    "packages/contracts/openapi/v1.generated.json",
    "packages/contracts/openapi/v1.inventory.json"
  ],
  "commits": [
    "696cb60"
  ],
  "completed_at": "2026-08-24T18:28:43+08:00",
  "completed_revision": "AOS-000202",
  "result": "COMPLETED_GREEN",
  "risks": [
    "GET-only privacy-minimized shell; no PII/protected contact, migration, customer authority write, provider/send, or real customer-data mutation."
  ],
  "schema": "aos-memory-delivery-receipt/v1",
  "task_id": "w2-08a-customer-contract-shell-20260824",
  "verification": [
    "focused/API/OpenAPI 22 passed",
    "Workshop API cumulative 109 passed",
    "deterministic OpenAPI, compileall and diff checks GREEN"
  ]
}
