{
  "base_revision": "AOS-000214",
  "blockers": [],
  "changed_files": [
    "services/aos-api/aos_api/aip_production_contracts.py",
    "services/aos-api/aos_api/aip_production_contract_store.py",
    "services/aos-api/aos_api/ecommerce_workshop_freeze_contracts.py",
    "services/aos-api/aos_api/ecommerce_workshop_freeze_service.py",
    "services/aos-api/aos_api/routers/ecommerce_workshop.py",
    "services/aos-api/alembic/versions/w3_014_production_context_profile.py",
    "services/aos-api/tests/test_ecommerce_workshop_freeze.py",
    "services/aos-api/tests/aip/test_w_l11_production_context.py",
    "packages/contracts/openapi/v1.generated.json",
    "packages/contracts/openapi/v1.inventory.json",
    ".evidence/workshop/2026-08-24-w3-04-production-context-freeze.json",
    "palantier/20_tech/电商平台接入/12-工作台层技术方案/93-W3-04四合同ProductionContext组合冻结与依赖解环ADR.md",
    "palantier/20_tech/电商平台接入/12-工作台层技术方案/D-waves/00-工作台长任务开发计划总清单.md"
  ],
  "commits": [
    "code=49bd762",
    "docs=9c431d1"
  ],
  "completed_at": "2026-08-24T23:31:39+08:00",
  "completed_revision": "AOS-000214",
  "result": "COMPLETED_CODE_CONTROL_GREEN_NO_RELEASE_MIGRATION_NOT_APPLIED",
  "risks": [
    "migration not live applied",
    "no release or real tenant business mutation"
  ],
  "schema": "aos-memory-delivery-receipt/v1",
  "task_id": "workshop-w3-04-production-context-freeze-20260824",
  "verification": [
    "focused=34 passed; 2 subtests passed",
    "cumulative=176 passed; 2 subtests passed",
    "openapi=2570 paths; 2123 schemas; 4338 operations; deterministic",
    "alembic=w3_014 head",
    "browser=/workshop failure-closed; 1280 width; no execution buttons"
  ]
}
