{
  "base_revision": "AOS-000340",
  "blockers": [],
  "changed_files": [
    "docs/palantier/20_tech/电商平台接入/12-工作台层技术方案/119-BI-W0经营参谋生意探究全量开发清单与波次实施计划.md",
    "apps/web/src/api/ecommerceInvestigation/client.ts",
    "apps/web/src/api/ecommerceInvestigation/contracts.ts",
    "apps/web/src/api/ecommerceInvestigation/parser.ts",
    "apps/web/src/components/workshop/BusinessInvestigationTab.tsx",
    "apps/web/src/styles/45-ecommerce-workshop.css",
    "services/aos-api/aos_api/ecommerce_business_investigation_data_command.py",
    "services/aos-api/aos_api/ecommerce_business_investigation_application.py",
    "services/aos-api/aos_api/ecommerce_business_investigation_projection.py",
    "services/aos-api/aos_api/routers/ecommerce_business_investigations.py"
  ],
  "commits": [
    "656dad9689c2328bbd2440b7ca012c87b2d4ab16",
    "8c4fcd6",
    "3beab72"
  ],
  "completed_at": "2026-08-27T03:57:29+08:00",
  "completed_revision": "AOS-000341",
  "result": "BI_W8_03_RECEIPT_FIRST_DATA_COMMAND_CODE_BROWSER_GREEN_VISUAL_PENDING_NO_EXTERNAL_EFFECT_NO_RELEASE",
  "risks": [
    "Final S8-Visual eight-menu frontend/backend/visual hard gate remains pending because current shell and visual baseline materially differ",
    "No real business data write source read fulfillment TaskRun resume Provider migration apply external effect or release"
  ],
  "schema": "aos-memory-delivery-receipt/v1",
  "task_id": "BI-W8-03-IMPL2",
  "verification": [
    "backend focused 33/33 and cumulative 236/236 GREEN",
    "web focused 26/26 and cumulative 255 files 2287 tests GREEN",
    "TypeScript Vite compileall Alembic single head biw8_001 diff-check GREEN",
    "built-in browser commands-off and safe fixture at 1280 1440 1920 GREEN; no POST clicked; console error 0"
  ]
}
