{
  "schema": "aos-memory-delivery-receipt/v1",
  "task_id": "aip-memory-b1-b3-authority-sync-2026-08-20",
  "base_revision": "AOS-000146",
  "completed_revision": "AOS-000146",
  "result": "MEMORY_VALIDATE_GREEN_AUTHORITY_SYNCED_W2_LOGIC_CODE_CONTROL",
  "changed_files": [
    "docs/palantier/AOS项目开发上下文/memory/authority.json",
    "docs/palantier/AOS项目开发上下文/memory/receipts/deliveries/aip-59-d20-d21-ops-2026-08-19.json",
    "docs/palantier/AOS项目开发上下文/memory/receipts/deliveries/aip-59-wave-progress-prime-assist-2026-08-19.json",
    "docs/palantier/AOS项目开发上下文/01-当前项目状态.md",
    "docs/palantier/AOS项目开发上下文/06-当前执行检查点.md",
    "docs/palantier/20_tech/电商平台接入/AIP通用能力实施方案/59-AIP侧栏全量剩余工作总清单.md",
    "docs/palantier/20_tech/电商平台接入/AIP通用能力实施方案/129-W-L7-Catalog-logicRevisionRef-additive.md"
  ],
  "commits": [
    "8e51438",
    "c827928"
  ],
  "verification": [
    "memory-validate GREEN after repairing two illegal delivery notes",
    "memory-sync --apply --prime; strong projections CURRENT; overall GREEN_WITH_WARNINGS (codex PENDING_ASYNC allowed)",
    "Authority source_commits synced m1/w1=8e51438 w2=c827928; consumed workshop-w2-catalog-logic-revision-ref-20260819 for code-control GREEN only",
    "W-L7 catalog logicRevisionRef contract tests 2 passed; checklist flipped"
  ],
  "risks": [
    "Browser acceptance and eight-menu navigation remain Workshop-owned; not claimed GREEN"
  ],
  "blockers": [
    "W2_BROWSER_ACCEPTANCE_PENDING",
    "W2_EIGHT_MENU_NAV_PENDING"
  ],
  "completed_at": "2026-08-20T13:25:00+08:00"
}
