{
  "schema": "aos-memory-delivery-receipt/v1",
  "task_id": "aip-59-d20-d21-ops-2026-08-19",
  "base_revision": "AOS-000146",
  "completed_revision": "AOS-000146",
  "result": "AIP_59_D20_D21_OPS_PROTOCOL_RECORDED",
  "changed_files": [
    "docs/palantier/20_tech/电商平台接入/AIP通用能力实施方案/59-AIP侧栏全量剩余工作总清单.md"
  ],
  "commits": [],
  "verification": [
    "D20/D21 ops protocol recorded for AIP 59 waves",
    "wave_protocol includes review_upper_scheme through next_wave",
    "scope remains aos-platform-w1-aip only; tenant org-org/dev-project",
    "replaced illegal delivery_ops_note with aos-memory-delivery-receipt/v1"
  ],
  "risks": [
    "original ops note lacked schema and blocked memory-validate for all shared-memory writers"
  ],
  "blockers": [],
  "completed_at": "2026-08-20T13:15:00+08:00"
}
