{
  "base_revision": "AOS-000332",
  "blockers": [],
  "changed_files": [
    "apps/web/src/api/ecommerceInvestigation/client.test.ts"
  ],
  "commits": [
    "10fab365481b8f66f772bfd6c2bae9a18e8c6e6b"
  ],
  "completed_at": "2026-08-27T00:35:28+08:00",
  "completed_revision": "AOS-000332",
  "result": "BI-W7-04A client contract addendum closed: exact Workbench v3 currentWorkspace contract and client fixture verification GREEN; no external effect or release.",
  "risks": [
    "NO_REAL_BUSINESS_DATA; NO_SOURCE_READ; NO_PROVIDER_EXECUTION; NO_EXTERNAL_EFFECT; NO_RELEASE"
  ],
  "schema": "aos-memory-delivery-receipt/v1",
  "task_id": "BI-W7-04A",
  "verification": [
    "frontend focused 12/12; Workshop Web 2271/2271; Vite build GREEN; diff-check GREEN"
  ]
}
