{
  "base_revision": "AOS-000368",
  "blockers": [
    "BI-W10 natural Cron remains 4/12; full ecom deterministic audit has 23 legacy fixture failures remaining"
  ],
  "changed_files": [
    "services/aos-api/tests/test_ec_d1_p04_category.py",
    "services/aos-api/tests/test_ec_d1_p04_api_config.py",
    "docs/palantier/20_tech/电商平台接入/12-工作台层技术方案/119-BI-W0经营参谋生意探究全量开发清单与波次实施计划.md"
  ],
  "commits": [
    "90f2d66d",
    "b03d79c"
  ],
  "completed_at": "2026-08-27T16:02:52+08:00",
  "completed_revision": "AOS-000368",
  "result": "P04_CATEGORY_FIXTURES_GREEN_REMAINING_FULL_ECOM_AUDIT_23",
  "risks": [
    "Production code unchanged; no real Source connection, Pipeline run, business-data mutation, external side effect, migration apply or release"
  ],
  "schema": "aos-memory-delivery-receipt/v1",
  "task_id": "BI-W11-01-P04-CATEGORY-FIXTURE-REPAIR",
  "verification": [
    "P04 category/API targeted 30/30 GREEN; cumulative with P02/P03, Step14, Dataset Sink and D1 Source/DLQ slices 145/145 GREEN; diff check GREEN; browser N/A"
  ]
}
