{
  "base_revision": "AOS-000161",
  "blockers": [],
  "changed_files": [
    "docs/palantier/20_tech/电商平台接入/12-工作台层技术方案/115-AOS单开发者串行接管与Workshop剩余74项实施方案.md"
  ],
  "commits": [
    "402d3c3"
  ],
  "completed_at": "2026-08-24T04:53:34+08:00",
  "completed_revision": "AOS-000161",
  "result": "W3_12A2_AUTHORITY_STORE_PLAN_GREEN",
  "risks": [
    "Plan authorizes fake-connection code tests only; real migration and business writes remain prohibited"
  ],
  "schema": "aos-memory-delivery-receipt/v1",
  "task_id": "w3-12a2-operation-case-store-plan-20260824",
  "verification": [
    "A2 internal Store scope, expectedVersion, canonical idempotency, tenant isolation, member conservation and no-effect boundaries frozen"
  ]
}
